<?xml version="1.0" encoding="UTF-8" ?>
<xs:schema xmlns:xs= "http://www.w3.org/2001/XMLSchema">
  <xs:import namespace="http://www.w3.org/XML/1998/namespace"
        schemaLocation="xml.xsd"/>
	
	<xs:element name= "DataPool">
		<xs:complexType>
			<xs:sequence>
				<xs:element name="Data" type="DataType" minOccurs="0" maxOccurs="unbounded"/>
			</xs:sequence>
			<xs:attribute ref="xml:lang"/>
		</xs:complexType>
	</xs:element>

	<xs:complexType name="DataType">
		<xs:sequence>
			<xs:element name="Name" type ="xs:string" minOccurs="1" maxOccurs="1"/>
		</xs:sequence>
		<xs:attribute ref="xml:id"/>
	</xs:complexType>
</xs:schema>